{
  "版": 1,
  "評価ExperimentID": "44444444444444444444444444444444",
  "評価DatasetID": "11111111111111111111111111111111",
  "Dataset定義hash": "sha256:0000000000000000000000000000000000000000000000000000000000000000",
  "評価CaseID": "22222222222222222222222222222222",
  "実行系ID": "runtime-a",
  "対話要求ID": "66666666666666666666666666666666",
  "対話セッションID": "77777777777777777777777777777777",
  "作成監査ID": "audit.evaluation.create.1",
  "開始監査ID": "audit.evaluation.start.1",
  "終了監査ID": "audit.evaluation.end.1",
  "実行系隔離予約監査ID": null,
  "評価監査ID": "audit.evaluation.result.1",
  "結果状態": "成功",
  "判定": "成立",
  "評価器判定一覧": [
    {
      "評価器ID": "aaaaaaaaaaaaaaaaaaaaaaaaaaaaaaaa",
      "種類": "exact",
      "判定": "成立",
      "理由code": "一致"
    }
  ],
  "実行時刻UnixMillis": 1726300000200,
  "LatencyMillis": 12,
  "応答hash": "sha256:5555555555555555555555555555555555555555555555555555555555555555",
  "証拠種別": "INTERNAL_STATE"
}
